<?xml version="1.0" encoding="UTF-8"?>
<schema xmlns="http://www.w3.org/2001/XMLSchema"
	targetNamespace="http://www.argouml.org/Namespace/argouml-sql"
	xmlns:tns="http://www.argouml.org/Namespace/argouml-sql"
	elementFormDefault="qualified">

	<element name="mappings" type="tns:mappingsType"></element>


	<complexType name="mappingsType">
		<sequence>
			<element name="database" type="tns:databaseType"
				maxOccurs="unbounded">
			</element>
		</sequence>
	</complexType>

	<complexType name="mappingType">
		<attribute name="umltype" type="string"></attribute>
		<attribute name="dbtype" type="string"></attribute>
	</complexType>

	<complexType name="databaseType">
		<sequence>
			<element name="mapping" type="tns:mappingType"
				maxOccurs="unbounded" minOccurs="0">
			</element>
		</sequence>
		<attribute name="name" type="string" use="required"></attribute>
	</complexType>
</schema>